{
  "material": "combattraces:metal",
  "priority": 100,
  "block_tags": [
    "minecraft:anvil",
    "c:storage_blocks/iron",
    "c:storage_blocks/copper",
    "c:storage_blocks/gold",
    "c:storage_blocks/netherite"
  ],
  "entities": [
    "minecraft:iron_golem"
  ],
  "armor_tags": [
    "combattraces:metal_armor"
  ],
  "particle": "minecraft:electric_spark",
  "color": "ffd188",
  "particle_count": 7
}
